province,city,district,address,school
内蒙古自治区,包头市,昆都仑区,内蒙古自治区包头市昆都仑区,内蒙古科技大学
内蒙古自治区,包头市,昆都仑区,内蒙古自治区包头市昆都仑区,内蒙古科技大学(包头师范学院)
内蒙古自治区,包头市,昆都仑区,内蒙古自治区包头市昆都仑区,内蒙古科技大学(包头医学院)
内蒙古自治区,包头市,昆都仑区,内蒙古自治区包头市昆都仑区阿尔丁大街76号,包头钢铁职业技术学院
内蒙古自治区,包头市,青山区,内蒙古自治区包头市青山区建华路19号,包头轻工职业技术学院
内蒙古自治区,包头市,青山区,内蒙古自治区包头市青山区,包头职业技术学院
内蒙古自治区,包头市,九原区,内蒙古自治区包头市九原区职教园区平安大道7号,包头铁道职业技术学院
内蒙古自治区,包头市,九原区,内蒙古自治区包头市九原区,内蒙古能源职业学院
内蒙古自治区,通辽市,科尔沁区,内蒙古自治区通辽市科尔沁区,内蒙古民族大学
内蒙古自治区,赤峰市,红山区,内蒙古自治区赤峰市红山区迎宾路1号,赤峰学院
内蒙古自治区,赤峰市,松山区,内蒙古自治区赤峰市松山区巴林北街22号,赤峰工业职业技术学院
内蒙古自治区,赤峰市,松山区,内蒙古自治区赤峰市松山区,内蒙古交通职业技术学院
内蒙古自治区,鄂尔多斯市,东胜区,内蒙古自治区鄂尔多斯市东胜区罕台镇科技教育创业园区,鄂尔多斯应用技术学院
内蒙古自治区,鄂尔多斯市,东胜区,内蒙古自治区鄂尔多斯市东胜区罕台镇厚德路18号,内蒙古民族幼儿师范高等专科学校
内蒙古自治区,鄂尔多斯市,康巴什区,内蒙古自治区鄂尔多斯市康巴什区,鄂尔多斯职业学院
内蒙古自治区,呼伦贝尔市,海拉尔区,内蒙古自治区呼伦贝尔市海拉尔区学府路,呼伦贝尔学院
内蒙古自治区,巴彦淖尔市,临河区,内蒙古自治区巴彦淖尔市临河区双河镇云中大街,河套学院
内蒙古自治区,巴彦淖尔市,临河区,内蒙古自治区巴彦淖尔市临河区,内蒙古鸿德文理学院
内蒙古自治区,乌兰察布市,集宁区,内蒙古自治区乌兰察布市集宁区工农大街,集宁师范学院
内蒙古自治区,乌兰察布市,集宁区,内蒙古自治区乌兰察布市集宁区,乌兰察布医学高等专科学校
内蒙古自治区,乌兰察布市,察哈尔右翼前旗,内蒙古自治区乌兰察布市察哈尔右翼前旗黄旗海镇满达东街,乌兰察布职业学院
内蒙古自治区,乌海市,海勃湾区,内蒙古自治区乌海市海勃湾区滨河街道滨河大道1号,乌海职业技术学院
内蒙古自治区,锡林郭勒盟,锡林浩特市,内蒙古自治区锡林郭勒盟锡林浩特市明安图街11号,锡林郭勒职业学院
内蒙古自治区,阿拉善盟,阿拉善左旗,内蒙古自治区阿拉善盟阿拉善左旗乌斯太镇,阿拉善职业技术学院
宁夏回族自治区,银川市,西夏区,宁夏回族自治区银川市西夏区贺兰山西路,宁夏大学
宁夏回族自治区,银川市,西夏区,宁夏回族自治区银川市西夏区贺兰山西路,宁夏医科大学
宁夏回族自治区,银川市,西夏区,宁夏回族自治区银川市西夏区朔方路,北方民族大学
宁夏回族自治区,银川市,西夏区,宁夏回族自治区银川市西夏区金波北街培华路1号,银川科技学院
宁夏回族自治区,银川市,西夏区,宁夏回族自治区银川市西夏区贺兰山西路686号,宁夏大学新华学院
宁夏回族自治区,银川市,西夏区,宁夏回族自治区银川市西夏区贺兰山西路街道学院东路355号,宁夏建设职业技术学院
宁夏回族自治区,银川市,西夏区,宁夏回族自治区银川市西夏区贺兰山西路街道学院西路31号,宁夏财经职业技术学院
宁夏回族自治区,银川市,西夏区,宁夏回族自治区银川市西夏区朔方路,宁夏工业职业学院
宁夏回族自治区,银川市,西夏区,宁夏回族自治区银川市西夏区,宁夏职业技术学院
宁夏回族自治区,银川市,永宁县,宁夏回族自治区银川市永宁县杨和镇,银川能源学院
宁夏回族自治区,银川市,永宁县,宁夏回族自治区银川市永宁县胜利乡,宁夏葡萄酒与防沙治沙职业技术学院
宁夏回族自治区,固原市,原州区,宁夏回族自治区固原市原州区,宁夏师范大学
宁夏回族自治区,石嘴山市,大武口区,宁夏回族自治区石嘴山市大武口区星海镇,宁夏理工学院
青海省,西宁市,城东区,青海省西宁市城东区,青海大学
青海省,西宁市,城东区,青海省西宁市城东区,青海师范大学
青海省,西宁市,城东区,青海省西宁市城东区,青海民族大学
青海省,西宁市,城东区,青海省西宁市城东区南川西路96号,青海建筑职业技术学院
青海省,西宁市,城东区,青海省西宁市城东区经二路66号,青海交通职业技术学院
青海省,西宁市,城西区,青海省西宁市城西区,青海大学昆仑学院
青海省,西宁市,城西区,青海省西宁市城西区西大街62号,青海畜牧兽医职业技术学院
青海省,西宁市,城北区,青海省西宁市城北区宁张路295号,西宁城市职业技术学院
青海省,海东市,乐都区,青海省海东市乐都区碾伯镇文教路109国道北侧,青海高等职业技术学院
山东省,济南市,历下区,山东省济南市历下区,山东大学
山东省,济南市,历下区,山东省济南市历下区,山东师范大学
山东省,济南市,历下区,山东省济南市历下区,齐鲁工业大学
山东省,济南市,历下区,山东省济南市历下区南辛庄西路336号,济南大学
山东省,济南市,历下区,山东省济南市历下区,山东财经大学
山东省,济南市,历下区,山东省济南市历下区,山东中医药大学
山东省,济南市,历下区,山东省济南市历下区,山东建筑大学
山东省,济南市,历下区,山东省济南市历下区,山东交通学院
山东省,济南市,历下区,山东省济南市历下区,齐鲁师范学院
山东省,济南市,历下区,山东省济南市历下区经十东路31699号,山东青年政治学院
山东省,济南市,历下区,山东省济南市历下区,山东管理学院
山东省,济南市,历下区,山东省济南市历下区,山东女子学院
山东省,济南市,历下区,山东省济南市历下区,山东农业工程学院
山东省,济南市,历下区,山东省济南市历下区,山东体育学院
山东省,济南市,历下区,山东省济南市历下区,山东政法学院
山东省,济南市,历下区,山东省济南市历下区,山东协和学院
山东省,济南市,历下区,山东省济南市历下区,齐鲁理工学院
山东省,济南市,历下区,山东省济南市历下区,山东工艺美术学院
山东省,济南市,历下区,山东省济南市历下区,山东艺术学院
山东省,济南市,历下区,山东省济南市历下区,山东外事职业大学
山东省,济南市,历下区,山东省济南市历下区,山东旅游职业学院
山东省,济南市,历下区,山东省济南市历下区,山东电子职业技术学院
山东省,济南市,历下区,山东省济南市历下区,山东医学高等专科学校
山东省,济南市,历下区,山东省济南市历下区,山东工程职业技术大学
山东省,济南市,历下区,山东省济南市历下区,山东服装职业学院
山东省,济南市,历下区,山东省济南市历下区,山东科技职业学院
山东省,济南市,历下区,山东省济南市历下区,山东职业学院
山东省,济南市,历城区,山东省济南市历城区彩石街道,山东商业职业技术学院
山东省,济南市,历城区,山东省济南市历城区彩石街道旅游路4657号,山东城市建设职业学院
山东省,济南市,历城区,山东省济南市历城区旅游路3636号,济南护理职业学院
山东省,济南市,历城区,山东省济南市历城区,山东传媒职业学院
山东省,济南市,长清区,山东省济南市长清区平安街道明发路1666号,山东圣翰财贸职业学院
山东省,济南市,长清区,山东省济南市长清区,济南工程职业技术学院
山东省,济南市,市中区,山东省济南市市中区舜耕路12号,济南职业学院
山东省,青岛市,崂山区,山东省青岛市崂山区,中国海洋大学
山东省,青岛市,崂山区,山东省青岛市崂山区,中国石油大学(华东)
山东省,青岛市,崂山区,山东省青岛市崂山区,青岛大学
山东省,青岛市,崂山区,山东省青岛市崂山区,山东科技大学
山东省,青岛市,崂山区,山东省青岛市崂山区松岭路99号,青岛科技大学
山东省,青岛市,崂山区,山东省青岛市崂山区抚顺路16号,青岛理工大学
山东省,青岛市,崂山区,山东省青岛市崂山区长城路700号,青岛农业大学
山东省,青岛市,崂山区,山东省青岛市崂山区,山东现代学院
山东省,青岛市,崂山区,山东省青岛市崂山区九水东路588号,青岛恒星科技学院
山东省,青岛市,崂山区,山东省青岛市崂山区九水东路599号,青岛酒店管理职业技术学院
山东省,青岛市,黄岛区,山东省青岛市黄岛区薛家岛街道,青岛电影学院
山东省,青岛市,城阳区,山东省青岛市城阳区惜福镇街道铁骑山路79号,青岛城市学院
山东省,青岛市,城阳区,山东省青岛市城阳区流亭街道丰海路51号,青岛求实职业技术学院
山东省,青岛市,市南区,山东省青岛市市南区江西路84号,青岛远洋船员职业学院
山东省,青岛市,市北区,山东省青岛市市北区福州南路246号,青岛工学院
山东省,青岛市,李沧区,山东省青岛市李沧区,山东外贸职业学院
山东省,青岛市,黄岛区,山东省青岛市黄岛区,青岛滨海学院
山东省,青岛市,黄岛区,山东省青岛市黄岛区海科二路316号,青岛港湾职业技术学院
山东省,青岛市,市北区,山东省青岛市市北区香江路128号,青岛职业技术学院
山东省,威海市,环翠区,山东省威海市环翠区,哈尔滨工业大学(威海)
山东省,威海市,环翠区,山东省威海市环翠区,山东大学威海分校
山东省,威海市,环翠区,山东省威海市环翠区,北京交通大学(威海校区)
山东省,威海市,环翠区,山东省威海市环翠区科技新城,威海职业学院
山东省,威海市,环翠区,山东省威海市环翠区海湾南路1000号,威海海洋职业学院
山东省,威海市,环翠区,山东省威海市环翠区,山东药品食品职业学院
山东省,烟台市,莱山区,山东省烟台市莱山区,烟台大学
山东省,烟台市,莱山区,山东省烟台市莱山区,山东工商学院
山东省,烟台市,莱山区,山东省烟台市莱山区滨海路街道港城东大街100号,烟台理工学院
山东省,烟台市,莱山区,山东省烟台市莱山区大学路1号,烟台南山学院
山东省,烟台市,蓬莱区,山东省烟台市蓬莱区蓬莱阁街道海滨西路1001号,烟台科技学院
山东省,烟台市,招远市,山东省烟台市招远市辛庄镇金海大道996号,烟台黄金职业学院
山东省,烟台市,福山区,山东省烟台市福山区珠江路92号,烟台工程职业技术学院
山东省,烟台市,莱山区,山东省烟台市莱山区聚贤路1号,烟台汽车工程职业学院
山东省,烟台市,莱山区,山东省烟台市莱山区滨海中路2018号,烟台职业学院
山东省,烟台市,莱山区,山东省烟台市莱山区,山东中医药高等专科学校
山东省,淄博市,张店区,山东省淄博市张店区,齐鲁医药学院
山东省,淄博市,张店区,山东省淄博市张店区,山东轻工职业学院
山东省,淄博市,张店区,山东省淄博市张店区,山东铝业职业学院
山东省,淄博市,张店区,山东省淄博市张店区,山东化工职业学院
山东省,淄博市,张店区,山东省淄博市张店区,山东工业职业学院
山东省,淄博市,周村区,山东省淄博市周村区北郊镇,淄博职业学院
山东省,淄博市,淄川区,山东省淄博市淄川区开发区唐骏欧铃路99号,淄博师范高等专科学校
山东省,泰安市,泰山区,山东省泰安市泰山区,山东第一医科大学
山东省,泰安市,泰山区,山东省泰安市泰山区,山东第二医科大学
山东省,泰安市,泰山区,山东省泰安市泰山区,泰山学院
山东省,泰安市,泰山区,山东省泰安市泰山区,泰山职业技术学院
山东省,泰安市,泰山区,山东省泰安市泰山区泰前街道迎胜东路8号,泰山护理职业学院
山东省,泰安市,泰山区,山东省泰安市泰山区,山东力明科技职业学院
山东省,潍坊市,奎文区,山东省潍坊市奎文区东风东街5147号,潍坊学院
山东省,潍坊市,奎文区,山东省潍坊市奎文区云门山南路9888号,潍坊理工学院
山东省,潍坊市,奎文区,山东省潍坊市奎文区金光街1299号,潍坊科技学院
山东省,潍坊市,奎文区,山东省潍坊市奎文区新城街道胜利东街88号,山东畜牧兽医职业学院
山东省,潍坊市,奎文区,山东省潍坊市奎文区东风东街8029号,潍坊职业学院
山东省,潍坊市,奎文区,山东省潍坊市奎文区,山东经贸职业学院
山东省,潍坊市,奎文区,山东省潍坊市奎文区,山东交通职业学院
山东省,潍坊市,奎文区,山东省潍坊市奎文区云门山南路8979号,潍坊工程职业学院
山东省,潍坊市,奎文区,山东省潍坊市奎文区云门山南路4318号,潍坊护理职业学院
山东省,潍坊市,奎文区,山东省潍坊市奎文区,山东海事职业学院
山东省,潍坊市,奎文区,山东省潍坊市奎文区凤凰路5600号,潍坊工商职业学院
山东省,枣庄市,市中区,山东省枣庄市市中区九龙南路,枣庄学院
山东省,枣庄市,薛城区,山东省枣庄市薛城区兴仁街道,枣庄职业学院
山东省,枣庄市,薛城区,山东省枣庄市薛城区学院东路888号,枣庄科技职业学院
山东省,济宁市,任城区,山东省济宁市任城区荷花路133号,济宁医学院
山东省,济宁市,任城区,山东省济宁市任城区杏坛路1号,济宁学院
山东省,济宁市,任城区,山东省济宁市任城区金宇路77号,济宁职业技术学院
山东省,济宁市,任城区,山东省济宁市任城区,山东理工职业学院
山东省,济宁市,曲阜市,山东省济宁市曲阜市石门山镇,曲阜远东职业技术学院
山东省,德州市,德城区,山东省德州市德城区大学西路566号,德州学院
山东省,德州市,德城区,山东省德州市德城区大学东路689号,德州职业技术学院
山东省,德州市,德城区,山东省德州市德城区禹王街566号,德州科技职业学院
山东省,滨州市,滨城区,山东省滨州市滨城区黄河三路522号,滨州医学院
山东省,滨州市,滨城区,山东省滨州市滨城区彭李街道黄河五路391号,山东航空学院
山东省,滨州市,滨城区,山东省滨州市滨城区黄河十四路与滨职路交汇处,滨州职业学院
山东省,东营市,东营区,山东省东营市东营区,山东石油化工学院
山东省,东营市,东营区,山东省东营市东营区府前大街129号,东营职业学院
山东省,东营市,广饶县,山东省东营市广饶县大王镇泰山路7号,东营科技职业学院
山东省,日照市,东港区,山东省日照市东港区,山东外国语职业学院
山东省,日照市,东港区,山东省日照市东港区秦楼街道学苑路677号,山东水利职业学院
山东省,日照市,东港区,山东省日照市东港区,日照职业技术学院
山东省,菏泽市,牡丹区,山东省菏泽市牡丹区大学路,菏泽学院
山东省,菏泽市,牡丹区,山东省菏泽市牡丹区大学路,菏泽医学专科学校
山东省,菏泽市,牡丹区,山东省菏泽市牡丹区长城路999号,菏泽职业学院
山东省,菏泽市,牡丹区,山东省菏泽市牡丹区南环路与君子南路交口南,菏泽家政职业学院
山东省,聊城市,东昌府区,山东省聊城市东昌府区文化路34号,聊城大学
山东省,聊城市,东昌府区,山东省聊城市东昌府区黄河路105号,聊城大学东昌学院
山东省,聊城市,东昌府区,山东省聊城市东昌府区花园北路133号,聊城职业技术学院
山东省,济南市,莱芜区,山东省济南市莱芜区山财大街1号,莱芜职业技术学院
山东省,烟台市,莱山区,山东省烟台市莱山区,海军航空大学
山东省,青岛市,崂山区,山东省青岛市崂山区,海军潜艇学院
山西省,太原市,小店区,山西省太原市小店区坞城路92号,山西大学
山西省,太原市,万柏林区,山西省太原市万柏林区迎泽西大街79号,太原理工大学
山西省,太原市,杏花岭区,山西省太原市杏花岭区新建路56号,山西医科大学
山西省,太原市,尖草坪区,山西省太原市尖草坪区学院路3号,中北大学
山西省,太原市,迎泽区,山西省太原市迎泽区坞城路696号,山西财经大学
山西省,太原市,万柏林区,山西省太原市万柏林区窊流路66号,太原科技大学
山西省,太原市,小店区,山西省太原市小店区黄陵路19号,太原师范学院
山西省,太原市,万柏林区,山西省太原市万柏林区西区,太原工业学院
山西省,太原市,小店区,山西省太原市小店区大昌南路18号,太原学院
山西省,太原市,尖草坪区,山西省太原市尖草坪区新兰路31号,山西工程技术学院
山西省,太原市,万柏林区,山西省太原市万柏林区徐沟镇政府西700米,山西警察学院
山西省,太原市,小店区,山西省太原市小店区,山西应用科技学院
山西省,太原市,万柏林区,山西省太原市万柏林区,山西工商学院
山西省,太原市,迎泽区,山西省太原市迎泽区坞城南路79号,山西财经大学华商学院
山西省,太原市,晋源区,山西省太原市晋源区,山西医科大学晋祠学院
山西省,太原市,小店区,山西省太原市小店区大昌南路17号,山西青年职业学院
山西省,太原市,万柏林区,山西省太原市万柏林区,山西铁道职业技术学院
山西省,太原市,迎泽区,山西省太原市迎泽区南内环西街1号,山西经贸职业学院
山西省,太原市,万柏林区,山西省太原市万柏林区晋祠路三段160号,山西电力职业技术学院
山西省,太原市,小店区,山西省太原市小店区许坦东街29号,山西旅游职业学院
山西省,太原市,迎泽区,山西省太原市迎泽区大昌南路19号,太原旅游职业学院
山西省,太原市,万柏林区,山西省太原市万柏林区龙堡街14号,山西国际商务职业学院
山西省,太原市,杏花岭区,山西省太原市杏花岭区万山沟3号,山西警官职业学院
山西省,太原市,小店区,山西省太原市小店区,山西体育职业学院
山西省,太原市,迎泽区,山西省太原市迎泽区,山西信息职业技术学院
山西省,太原市,万柏林区,山西省太原市万柏林区九丰路,太原城市职业技术学院
山西省,太原市,小店区,山西省太原市小店区迎新南巷10号,山西金融职业学院
山西省,太原市,清徐县,山西省太原市清徐县,太原幼儿师范高等专科学校
山西省,晋中市,榆次区,山西省晋中市榆次区,山西农业大学
山西省,晋中市,榆次区,山西省晋中市榆次区,山西中医药大学
山西省,晋中市,榆次区,山西省晋中市榆次区正太北街,晋中学院
山西省,晋中市,榆次区,山西省晋中市榆次区,山西能源学院
山西省,晋中市,榆次区,山西省晋中市榆次区文华街369号,山西工程科技职业大学
山西省,晋中市,榆次区,山西省晋中市榆次区,山西传媒学院
山西省,晋中市,榆次区,山西省晋中市榆次区学院路8号,晋中信息学院
山西省,晋中市,榆次区,山西省晋中市榆次区工业园区8号路15号,山西晋中理工学院
山西省,晋中市,榆次区,山西省晋中市榆次区广安街99号,晋中师范高等专科学校
山西省,晋中市,榆次区,山西省晋中市榆次区蕴华西街229号,晋中职业技术学院
山西省,太原市,迎泽区,山西省太原市迎泽区坞城路696号,山西师范大学
山西省,临汾市,尧都区,山西省临汾市尧都区临浮路埝下村,临汾职业技术学院
山西省,大同市,平城区,山西省大同市平城区,山西大同大学
山西省,大同市,平城区,山西省大同市平城区同泉路1081号,大同师范高等专科学校
山西省,大同市,平城区,山西省大同市平城区安居街106号,大同煤炭职业技术学院
山西省,长治市,潞州区,山西省长治市潞州区城北东街73号,长治学院
山西省,长治市,潞州区,山西省长治市潞州区延安南路110号,长治医学院
山西省,长治市,潞州区,山西省长治市潞州区延安中路505号,长治职业技术学院
山西省,长治市,潞州区,山西省长治市潞州区,山西机电职业技术学院
山西省,运城市,盐湖区,山西省运城市盐湖区复旦西街1155号,运城学院
山西省,运城市,盐湖区,山西省运城市盐湖区文化产业园学院西路2号,运城师范高等专科学校
山西省,运城市,盐湖区,山西省运城市盐湖区空港南区,运城幼儿师范高等专科学校
山西省,运城市,盐湖区,山西省运城市盐湖区北相镇复旦西街2155号,运城护理职业学院
山西省,运城市,盐湖区,山西省运城市盐湖区学院北路2555号,运城职业技术大学
山西省,阳泉市,郊区,山西省阳泉市郊区上城街59号,阳泉师范高等专科学校
山西省,阳泉市,郊区,山西省阳泉市郊区,阳泉职业技术学院
山西省,朔州市,朔城区,山西省朔州市朔城区开发区燕家河路6号,山西工学院
山西省,朔州市,朔城区,山西省朔州市朔城区长宁街85号,朔州师范高等专科学校
山西省,朔州市,朔城区,山西省朔州市朔城区,朔州职业技术学院
山西省,忻州市,忻府区,山西省忻州市忻府区和平西街10号,忻州师范学院
山西省,忻州市,忻府区,山西省忻州市忻府区开发区学院路1号,忻州职业技术学院
山西省,吕梁市,离石区,山西省吕梁市离石区学院路1号,吕梁学院
山西省,吕梁市,离石区,山西省吕梁市离石区胜溪湖畔,吕梁职业技术学院
山西省,晋城市,城区,山西省晋城市城区北石店镇泽州路18号,山西科技学院
山西省,晋城市,城区,山西省晋城市城区,晋城职业技术学院
陕西省,西安市,雁塔区,陕西省西安市雁塔区雁塔路199号,西安交通大学
陕西省,西安市,碑林区,陕西省西安市碑林区友谊西路127号,西北工业大学
陕西省,西安市,雁塔区,陕西省西安市雁塔区太白南路2号,西安电子科技大学
陕西省,西安市,碑林区,陕西省西安市碑林区太白北路229号,西北大学
陕西省,西安市,长安区,陕西省西安市长安区西长安街620号,陕西师范大学
陕西省,西安市,碑林区,陕西省西安市碑林区南二环路中段,长安大学
陕西省,西安市,碑林区,陕西省西安市碑林区金花南路5号,西安理工大学
陕西省,西安市,碑林区,陕西省西安市碑林区雁塔路13号,西安建筑科技大学
陕西省,西安市,未央区,陕西省西安市未央区大学园路2号,陕西科技大学
陕西省,西安市,临潼区,陕西省西安市临潼区陕鼓大道48号,西安科技大学
陕西省,西安市,雁塔区,陕西省西安市雁塔区长安南路563号,西安邮电大学
陕西省,西安市,雁塔区,陕西省西安市雁塔区长安南路300号,西北政法大学
陕西省,西安市,雁塔区,陕西省西安市雁塔区电子二路18号,西安石油大学
陕西省,西安市,未央区,陕西省西安市未央区金花北路95号,西安工业大学
陕西省,西安市,临潼区,陕西省西安市临潼区陕鼓大道58号,西安工程大学
陕西省,西安市,雁塔区,陕西省西安市雁塔区长安南路437号,西安外国语大学
陕西省,西安市,长安区,陕西省西安市长安区常宁大道南段2号,西安财经大学
陕西省,西安市,莲湖区,陕西省西安市莲湖区西二环259号,西安航空学院
陕西省,西安市,长安区,陕西省西安市长安区郭杜教育科技产业开发区文苑南路,陕西学前师范学院
陕西省,西安市,莲湖区,陕西省西安市莲湖区土门十字西南角,西安医学院
陕西省,西安市,碑林区,陕西省西安市碑林区含光北路399号,西安体育学院
陕西省,西安市,新城区,陕西省西安市新城区长乐西路145号,空军军医大学
陕西省,西安市,雁塔区,陕西省西安市雁塔区狄寨路57号,西安财经大学行知学院
陕西省,西安市,长安区,陕西省西安市长安区韦曲南路,西安科技大学高新学院
陕西省,西安市,长安区,陕西省西安市长安区韦曲街道皂河路2号,延安大学西安创新学院
陕西省,西安市,雁塔区,陕西省西安市雁塔区鱼化寨街道富裕路81号,长安大学兴华学院
陕西省,西安市,长安区,陕西省西安市长安区黄良街道子午大道35号,西安理工大学高科学院
陕西省,西安市,长安区,陕西省西安市长安区滦镇街道科教园陈北路1号,西北大学现代学院
陕西省,西安市,雁塔区,陕西省西安市雁塔区丈八北路408号,西安外事学院
陕西省,西安市,鄠邑区,陕西省西安市鄠邑区渼陂西路1号,西安交通工程学院
陕西省,西安市,长安区,陕西省西安市长安区太乙路123号,西安翻译学院
陕西省,西安市,未央区,陕西省西安市未央区未央路2号,西京学院
陕西省,西安市,长安区,陕西省西安市长安区韦曲街道常宁路888号,西安培华学院
陕西省,西安市,高陵区,陕西省西安市高陵区鹿祥路235号,西安工商学院
