province,city,district,address,school
江苏,南京市,栖霞区,江苏省南京市栖霞区仙林大道169号,南京财经大学红山学院
江苏,苏州市,吴中区,江苏省苏州市吴中区石湖西路188号,苏州大学应用技术学院
江苏,昆山市,花桥镇,江苏省昆山市花桥镇杜克大道8号,昆山杜克大学
江苏,扬州市,邗江区,江苏省扬州市邗江区南路199号,扬州大学广陵学院
江苏,苏州市,张家港市,江苏省苏州市张家港市杨舍镇长兴中路8号,江苏科技大学苏州理工学院
江苏,南京市,栖霞区,江苏省南京市栖霞区马群街169号,南京医科大学康达学院
江苏,常州市,武进区,江苏省常州市武进区滆湖中路2号,常州大学怀德学院
江苏,泰州市,海陵区,江苏省泰州市海陵区药城大道1号,南京中医药大学翰林学院
江苏,南京市,江宁区,江苏省南京市江宁区文苑路9号,东南大学成贤学院
江苏,南京市,江宁区,江苏省南京市江宁区科教路99号,南京大学金陵学院
江苏,徐州市,铜山区,江苏省徐州市铜山区上海路101号,江苏师范大学科文学院
江苏,扬州市,邗江区,江苏省扬州市邗江区润扬南路33号,南京邮电大学通达学院
江苏,泰州市,海陵区,江苏省泰州市海陵区济川东路96号,南京师范大学泰州学院
江苏,泰州市,海陵区,江苏省泰州市海陵区迎春路88号,南京理工大学泰州科技学院
江苏,南通市,崇川区,江苏省南通市崇川区永兴路14号,南通理工学院
江苏,南京市,栖霞区,江苏省南京市栖霞区仙林大道158号,三江学院
江苏,无锡市,滨湖区,江苏省无锡市滨湖区蠡湖大道1800号,无锡太湖学院
江苏,南京市,溧水区,江苏省南京市溧水区石湫街道励学路9号,南京工业大学浦江学院
江苏,徐州市,泉山区,江苏省徐州市泉山区金山东路1号,中国矿业大学徐海学院
江苏,南京市,栖霞区,江苏省南京市栖霞区仙林大道2号,解放军国际关系学院
江苏,南京市,白下区,江苏省南京市白下区中山东路88号,南京政治学院
江苏,南通市,崇川区,江苏省南通市崇川区啬园路9号,南通大学杏林学院
江苏,南京市,江宁区,江苏省南京市江宁区淳化街道弘景大道3666号,南京传媒学院
江苏,南京市,秦淮区,江苏省南京市秦淮区中山东路264号,解放军理工大学
江苏,南京市,栖霞区,江苏省南京市栖霞区仙林街道文澜路89号,南京理工大学紫金学院
江苏,南京市,白下区,江苏省南京市白下区中山东路200号,解放军南京陆军指挥学院
江苏,南京市,鼓楼区,江苏省南京市鼓楼区北京西路74号,南京艺术学院
江苏,南通市,崇川区,江苏省南通市崇川区青年中路89号,江苏商贸职业学院
江苏,徐州市,沛县,江苏省徐州市沛县张寨镇253省道,徐州生物工程职业技术学院
江苏,徐州市,云龙区,江苏省徐州市云龙区大学路1号,江苏安全技术职业学院
江苏,镇江市,京口区,江苏省镇江市京口区学府路301号,江苏航空职业技术学院
江苏,常州市,钟楼区,江苏省常州市钟楼区邹区镇殷村和裕路1号,江苏城乡建设职业学院
江苏,扬州市,邗江区,江苏省扬州市邗江区新盛街道文汇西路608号,扬州中瑞酒店职业学院
江苏,徐州市,贾汪区,江苏省徐州市贾汪区潘安湖街道荒里村,徐州幼儿师范高等专科学校
江苏,苏州市,工业园区,江苏省苏州市工业园区若水路99号,苏州工业园区服务外包职业学院
江苏,宿迁市,宿豫区,江苏省宿迁市宿豫区晓店街道合欢路66号,宿迁泽达职业技术学院
江苏,苏州市,吴江区,江苏省苏州市吴江区松陵街道鲈乡南路1237号,苏州信息职业技术学院
江苏,南京市,浦口区,江苏省南京市浦口区江浦街道黄山岭路69号,江苏卫生健康职业学院
江苏,南京市,江宁区,江苏省南京市江宁区淳化街道月华西路1号,南京旅游职业学院
江苏,苏州市,工业园区,江苏省苏州市工业园区独墅湖大道1号,苏州高博职业学院
江苏,连云港市,海州区,江苏省连云港市海州区花果山街道,江苏财会职业学院
江苏,南京市,高淳区,江苏省南京市高淳区古柏街道鹿鸣大道33号,南京机电职业技术学院
江苏,南京市,溧水区,江苏省南京市溧水区柘塘街道柘宁东路116号,南京视觉艺术职业学院
江苏,昆山市,玉山镇,江苏省昆山市玉山镇萧林中路99号,昆山登云科技职业学院
江苏,扬州市,邗江区,江苏省扬州市邗江区工农路,扬州工业职业技术学院
江苏,淮安市,清江浦区,江苏省淮安市清江浦区枚乘东路4号,江苏财经职业技术学院
江苏,苏州市,昆山市,江苏省苏州市昆山市健雄路1号,苏州健雄职业技术学院
江苏,徐州市,泉山区,江苏省徐州市泉山区金山东路2号,金山职业技术学院
江苏,无锡市,宜兴市,江苏省无锡市宜兴市宜城街道荆邑南路99号,无锡工艺职业技术学院
江苏,无锡市,滨湖区,江苏省无锡市滨湖区钱藕路12号,无锡城市职业技术学院
江苏,无锡市,江阴市,江苏省无锡市江阴市南闸街道锡澄路168号,江阴职业技术学院
江苏,常州市,武进区,江苏省常州市武进区湖塘镇鸣新中路26号,常州机电职业技术学院
江苏,扬州市,邗江区,江苏省扬州市邗江区扬子江南路5号,江海职业技术学院
江苏,南京市,栖霞区,江苏省南京市栖霞区仙林街道文澜路99号,南京信息职业技术学院
江苏,宿迁市,宿豫区,江苏省宿迁市宿豫区晓店街道,宿迁职业技术学院
江苏,徐州市,鼓楼区,江苏省徐州市鼓楼区九里街道,徐州工业职业技术学院
江苏,南京市,浦口区,江苏省南京市浦口区珍珠南路65号,南京铁道职业技术学院
江苏,常州市,新北区,江苏省常州市新北区新桥街道嫩江路1号,建东职业技术学院
江苏,淮安市,淮阴区,江苏省淮安市淮阴区枚乘东路4号,江苏食品药品职业技术学院
江苏,常州市,武进区,江苏省常州市武进区文昌东路19号,江苏农林职业技术学院
江苏,常州市,武进区,江苏省常州市武进区滆湖中路1号,常州工程职业技术学院
江苏,常州市,武进区,江苏省常州市武进区鸣新中路28号,常州工业职业技术学院
江苏,南京市,江宁区,江苏省南京市江宁区禄口街道金铜路2号,金肯职业技术学院
江苏,无锡市,惠山区,江苏省无锡市惠山区钱桥街道钱藕路2号,江南影视艺术职业学院
江苏,南京市,江宁区,江苏省南京市江宁区弘景大道88号,江苏信息职业技术学院
江苏,无锡市,滨湖区,江苏省无锡市滨湖区山水西路99号,无锡南洋职业技术学院
江苏,南京市,江宁区,江苏省南京市江宁区秣陵街道将军大道18号,正德职业技术学院
江苏,南京市,栖霞区,江苏省南京市栖霞区葛关路625号,南京科技职业学院
江苏,淮安市,涟水县,江苏省淮安市涟水县涟城街道炎黄大道东1号,炎黄职业技术学院
江苏,无锡市,滨湖区,江苏省无锡市滨湖区荣巷街道钱荣路,太湖创意职业技术学院
江苏,苏州市,工业园区,江苏省苏州市工业园区若水路1号,苏州工业园区职业技术学院
江苏,苏州市,虎丘区,江苏省苏州市虎丘区西园路279号,苏州农业职业技术学院
江苏,常州市,武进区,江苏省常州市武进区滆湖中路3号,常州纺织服装职业技术学院
江苏,南京市,栖霞区,江苏省南京市栖霞区马群街道马群街169号,钟山职业技术学院
江苏,泰州市,海陵区,江苏省泰州市海陵区城南街道凤凰东路8号,江苏农牧科技职业学院
江苏,南京市,江宁区,江苏省南京市江宁区龙眠大道629号,南京交通职业技术学院
江苏,南通市,崇川区,江苏省南通市崇川区新开街道通盛大道185号,江苏航运职业技术学院
江苏,无锡市,滨湖区,江苏省无锡市滨湖区胡埭镇钱胡公路809号,无锡商业职业技术学院
江苏,苏州市,虎丘区,江苏省苏州市虎丘区宝带西路1108号,苏州卫生职业技术学院
江苏,苏州市,虎丘区,江苏省苏州市虎丘区横塘街道致能大道1号,苏州工业职业技术学院
江苏,苏州市,虎丘区,江苏省苏州市虎丘区学府路287号,苏州经贸职业技术学院
江苏,南通市,崇川区,江苏省南通市崇川区学田街道青年中路136号,南通科技职业学院
江苏,盐城市,亭湖区,江苏省盐城市亭湖区希望大道南路8号,江苏医药职业学院
江苏,无锡市,新吴区,江苏省无锡市新吴区旺庄街道新锡路8号,无锡科技职业学院
江苏,南京市,栖霞区,江苏省南京市栖霞区仙林大道2号,江苏海事职业技术学院
江苏,常州市,武进区,江苏省常州市武进区湖塘镇鸣新中路22号,常州信息职业技术学院
江苏,泰州市,海陵区,江苏省泰州市海陵区天星路8号,泰州职业技术学院
江苏,苏州市,昆山市,江苏省苏州市昆山市花桥镇,硅湖职业技术学院
江苏,徐州市,泉山区,江苏省徐州市泉山区金山东路3号,九州职业技术学院
江苏,南京市,江宁区,江苏省南京市江宁区文鼎路88号,江苏经贸职业技术学院
江苏,苏州市,吴江区,江苏省苏州市吴江区松陵镇开平路88号,沙洲职业工学院
江苏,苏州市,虎丘区,江苏省苏州市虎丘区学府路1号,苏州职业大学
江苏,南通市,崇川区,江苏省南通市崇川区青年中路89号,南通职业大学
江西省,南昌市,青山湖区,江西省南昌市青山湖区,南昌大学
江西省,南昌市,青山湖区,江西省南昌市青山湖区,江西财经大学
江西省,南昌市,青山湖区,江西省南昌市青山湖区,江西师范大学
江西省,南昌市,青山湖区,江西省南昌市青山湖区,南昌航空大学
江西省,南昌市,青山湖区,江西省南昌市青山湖区,江西理工大学
江西省,南昌市,青山湖区,江西省南昌市青山湖区,华东交通大学
江西省,南昌市,青山湖区,江西省南昌市青山湖区,江西农业大学
江西省,南昌市,青山湖区,江西省南昌市青山湖区,东华理工大学
江西省,赣州市,章贡区,江西省赣州市章贡区,赣南师范大学
江西省,南昌市,青山湖区,江西省南昌市青山湖区,江西中医药大学
江西省,吉安市,吉州区,江西省吉安市吉州区,井冈山大学
江西省,景德镇市,昌江区,江西省景德镇市昌江区行知路,景德镇陶瓷大学
江西省,南昌市,青山湖区,江西省南昌市青山湖区天祥大道289号,南昌工程学院
江西省,南昌市,青山湖区,江西省南昌市青山湖区,江西科技师范大学
江西省,宜春市,袁州区,江西省宜春市袁州区学府路576号,宜春学院
江西省,上饶市,信州区,江西省上饶市信州区南环路85号,上饶师范学院
江西省,赣州市,章贡区,江西省赣州市南康区新康东大道北50米,赣南医科大学
江西省,南昌市,红谷滩区,江西省南昌市红谷滩区瑞香路889号,南昌师范学院
江西省,九江市,浔阳区,江西省九江市浔阳区前进东路,九江学院
江西省,萍乡市,安源区,江西省萍乡市安源区,萍乡学院
江西省,景德镇市,昌江区,江西省景德镇市昌江区,景德镇学院
江西省,新余市,渝水区,江西省新余市渝水区,新余学院
江西省,南昌市,青山湖区,江西省南昌市青山湖区梅岭大道1999号,豫章师范学院
江西省,赣州市,章贡区,江西省赣州市章贡区客家大道156号,赣南科技学院
江西省,抚州市,临川区,江西省抚州市临川区,赣东学院
江西省,南昌市,红谷滩区,江西省南昌市红谷滩区复兴大街以北,南昌医学院
江西省,南昌市,青山湖区,江西省南昌市青山湖区,江西农业大学南昌商学院
江西省,九江市,共青城市,江西省九江市共青城市,江西财经大学现代经济管理学院
江西省,南昌市,青山湖区,江西省南昌市青山湖区,南昌航空大学科技学院
江西省,景德镇市,浮梁县,江西省景德镇市浮梁县和谐大道,景德镇艺术职业大学
江西省,九江市,共青城市,江西省九江市共青城市,南昌大学共青学院
江西省,南昌市,红谷滩区,江西省南昌市红谷滩区明月山大道1599号,南昌应用技术师范学院
江西省,赣州市,章贡区,江西省赣州市章贡区南外街道,赣南师范大学科技学院
江西省,南昌市,青山湖区,江西省南昌市青山湖区,南昌大学科学技术学院
江西省,南昌市,青山湖区,江西省南昌市青山湖区,江西师范大学科学技术学院
江西省,南昌市,青山湖区,江西省南昌市青山湖区黄家湖东路111号,南昌交通学院
江西省,南昌市,青山湖区,江西省南昌市青山湖区,江西服装学院
江西省,南昌市,青山湖区,江西省南昌市青山湖区,江西科技学院
江西省,南昌市,青山湖区,江西省南昌市青山湖区,江西工程学院
江西省,南昌市,青山湖区,江西省南昌市青山湖区,江西应用科技学院
江西省,南昌市,青山湖区,江西省南昌市青山湖区生米镇创业南路998号,南昌工学院
江西省,南昌市,南昌县,江西省南昌市南昌县蒋巷镇蒋巷西大道266号,南昌影视传播职业学院
江西省,吉安市,吉州区,江西省吉安市吉州区,吉安职业技术学院
江西省,宜春市,袁州区,江西省宜春市袁州区锦绣大道1699号,宜春幼儿师范高等专科学校
江西省,赣州市,章贡区,江西省赣州市章贡区,赣州师范高等专科学校
江西省,新余市,渝水区,江西省新余市渝水区河下镇,江西冶金职业技术学院
江西省,南昌市,青山湖区,江西省南昌市青山湖区,江西农业大学南昌商学院
江西省,南昌市,青山湖区,江西省南昌市青山湖区北山路99号,江西水利职业学院
江西省,景德镇市,浮梁县,江西省景德镇市浮梁县县衙路119号,景德镇陶瓷职业技术学院
江西省,南昌市,青山湖区,江西省南昌市青山湖区,江西工商职业技术学院
江西省,南昌市,南昌县,江西省南昌市南昌县蒋巷镇蒋巷西大道266号,江西传媒职业学院
江西省,南昌市,南昌县,江西省南昌市南昌县小蓝经济开发区金沙二路1888号,江西泰豪动漫职业学院
江西省,九江市,永修县,江西省九江市永修县艾城镇马湾村内,江西枫林涉外经贸职业学院
江西省,九江市,共青城市,江西省九江市共青城市甘鹿镇共青大道1号,共青科技职业学院
江西省,新余市,渝水区,江西省新余市渝水区城北街道赣西大道598号,赣西科技职业学院
江西省,南昌市,青山湖区,江西省南昌市青山湖区,江西工程职业学院
江西省,南昌市,青山湖区,江西省南昌市青山湖区,江西航空职业技术学院
江西省,南昌市,青山湖区,江西省南昌市青山湖区紫阳大道318号,江西制造职业技术学院
江西省,南昌市,青山湖区,江西省南昌市青山湖区,江西软件职业技术大学
江西省,上饶市,信州区,江西省上饶市信州区茅家岭街道志敏东大道397号,上饶幼儿师范高等专科学校
江西省,南昌市,青山湖区,江西省南昌市青山湖区,江西农业大学南昌商学院
江西省,抚州市,临川区,江西省抚州市临川区迎宾大道,抚州职业技术学院
江西省,南昌市,南昌县,江西省南昌市南昌县莲塘北大道1636号,江西生物科技职业学院
江西省,萍乡市,安源区,江西省萍乡市安源区,江西应用工程职业学院
江西省,南昌市,青山湖区,江西省南昌市青山湖区,江西工业贸易职业技术学院
江西省,南昌市,青山湖区,江西省南昌市青山湖区,江西外语外贸职业学院
江西省,南昌市,青山湖区,江西省南昌市青山湖区,南昌职业大学
江西省,南昌市,青山湖区,江西省南昌市青山湖区,江西科技职业学院
江西省,萍乡市,安源区,江西省萍乡市安源区,江西工业工程职业技术学院
江西省,赣州市,章贡区,江西省赣州市章贡区,江西应用技术职业学院
江西省,九江市,浔阳区,江西省九江市浔阳区,江西财经职业学院
江西省,南昌市,青山湖区,江西省南昌市青山湖区枫林东大街644号,江西交通职业技术学院
江西省,南昌市,青山湖区,江西省南昌市青山湖区,江西信息应用职业技术学院
江西省,南昌市,青山湖区,江西省南昌市青山湖区,江西艺术职业学院
江西省,赣州市,章贡区,江西省赣州市章贡区,江西环境工程职业学院
江西省,南昌市,青山湖区,江西省南昌市青山湖区,江西电力职业技术学院
江西省,南昌市,青山湖区,江西省南昌市青山湖区,江西机电职业技术学院
江西省,景德镇市,昌江区,江西省景德镇市昌江区新厂西路486号,江西陶瓷工艺美术职业技术学院
江西省,南昌市,青山湖区,江西省南昌市青山湖区,江西司法警官职业学院
江西省,九江市,浔阳区,江西省九江市浔阳区濂溪大道88号,九江职业大学
江西省,上饶市,信州区,江西省上饶市信州区志敏大道399号,江西医学高等专科学校
江西省,南昌市,青山湖区,江西省南昌市青山湖区,江西工业职业技术学院
江西省,南昌市,青山湖区,江西省南昌市青山湖区,江西职业技术大学
江西省,宜春市,袁州区,江西省宜春市袁州区中山西路,宜春职业技术学院
江西省,南昌市,青山湖区,江西省南昌市青山湖区,陆军步兵学院
江西省,上饶市,信州区,江西省上饶市信州区茅家岭街道志敏东大道397号,上饶幼儿师范高等专科学校
辽宁省,大连市,甘井子区,辽宁省大连市甘井子区,大连理工大学
辽宁省,大连市,甘井子区,辽宁省大连市甘井子区红旗西路600号,大连软件职业学院
辽宁省,大连市,甘井子区,辽宁省大连市甘井子区,大连汽车职业技术学院
辽宁省,大连市,甘井子区,辽宁省大连市甘井子区营城子镇,大连枫叶职业技术学院
辽宁省,大连市,金州区,辽宁省大连市金州区,大连交通大学
辽宁省,大连市,金州区,辽宁省大连市金州区站前街道金港路288号,辽宁轻工职业学院
辽宁省,大连市,金州区,辽宁省大连市金州区大魏家街道前石村,大连装备制造职业技术学院
辽宁省,大连市,金州区,辽宁省大连市金州区人文街80号,大连财经学院
辽宁省,大连市,旅顺口区,辽宁省大连市旅顺口区旅顺南路西段9号,大连医科大学
辽宁省,大连市,旅顺口区,辽宁省大连市旅顺口区旅顺南路西段6-10号,大连外国语大学
辽宁省,大连市,沙河口区,辽宁省大连市沙河口区,中国医科大学
辽宁省,大连市,沙河口区,辽宁省大连市沙河口区,东北财经大学
辽宁省,大连市,沙河口区,辽宁省大连市沙河口区,辽宁大学
辽宁省,大连市,沙河口区,辽宁省大连市沙河口区,大连大学
辽宁省,大连市,西岗区,辽宁省大连市西岗区凌海路1号,大连海事大学
辽宁省,大连市,中山区,辽宁省大连市中山区,大连工业大学
辽宁省,大连市,中山区,辽宁省大连市中山区,大连海洋大学
辽宁省,大连市,中山区,辽宁省大连市中山区,大连民族大学
辽宁省,沈阳市,和平区,辽宁省沈阳市和平区,东北大学
辽宁省,沈阳市,和平区,辽宁省沈阳市和平区,辽宁师范大学
辽宁省,沈阳市,皇姑区,辽宁省沈阳市皇姑区塔湾街83号,中国刑事警察学院
辽宁省,沈阳市,沈北新区,辽宁省沈阳市沈北新区东陵路120号,沈阳农业大学
辽宁省,沈阳市,铁西区,辽宁省沈阳市铁西区,沈阳工业大学
辽宁省,沈阳市,于洪区,辽宁省沈阳市于洪区造化乡郭大桥村,辽宁广告职业学院
辽宁省,沈阳市,浑南区,辽宁省沈阳市浑南区,沈阳航空航天大学
辽宁省,沈阳市,浑南区,辽宁省沈阳市浑南区,沈阳建筑大学
辽宁省,沈阳市,浑南区,辽宁省沈阳市浑南区,沈阳药科大学
辽宁省,沈阳市,浑南区,辽宁省沈阳市浑南区凤凰大街9号,沈阳音乐学院
辽宁省,鞍山市,铁东区,辽宁省鞍山市铁东区,辽宁科技大学
辽宁省,鞍山市,铁东区,辽宁省鞍山市铁东区平安街43号,鞍山师范学院
辽宁省,本溪市,平山区,辽宁省本溪市平山区环山路60号,辽宁冶金职业技术学院
辽宁省,丹东市,振兴区,辽宁省丹东市振兴区,辽东学院
辽宁省,丹东市,振兴区,辽宁省丹东市振兴区接梨树大街1号,辽宁地质工程职业学院
辽宁省,抚顺市,顺城区,辽宁省抚顺市顺城区,辽宁石油化工大学
辽宁省,抚顺市,顺城区,辽宁省抚顺市顺城区旺力街89号,抚顺职业技术学院
辽宁省,阜新市,海州区,辽宁省阜新市海州区,辽宁工程技术大学
辽宁省,葫芦岛市,龙港区,辽宁省葫芦岛市龙港区,渤海船舶职业学院
辽宁省,锦州市,古塔区,辽宁省锦州市古塔区,渤海大学
辽宁省,锦州市,太和区,辽宁省锦州市太和区松坡路40号,锦州医科大学
辽宁省,盘锦市,兴隆台区,辽宁省盘锦市兴隆台区,盘锦职业技术学院
辽宁省,营口市,站前区,辽宁省营口市站前区博文路46号,营口理工学院
辽宁省,沈阳市,浑南区,辽宁省沈阳市浑南区,沈阳师范大学
辽宁省,沈阳市,浑南区,辽宁省沈阳市浑南区,沈阳化工大学
辽宁省,沈阳市,浑南区,辽宁省沈阳市浑南区,沈阳理工大学
辽宁省,沈阳市,浑南区,辽宁省沈阳市浑南区,沈阳医学院
辽宁省,沈阳市,浑南区,辽宁省沈阳市浑南区,沈阳大学
辽宁省,沈阳市,浑南区,辽宁省沈阳市浑南区,沈阳科技学院
辽宁省,沈阳市,浑南区,辽宁省沈阳市浑南区,沈阳城市建设学院
辽宁省,沈阳市,浑南区,辽宁省沈阳市浑南区,沈阳城市学院
辽宁省,沈阳市,浑南区,辽宁省沈阳市浑南区,沈阳工学院
辽宁省,沈阳市,浑南区,辽宁省沈阳市浑南区,辽宁装备制造职业技术学院
辽宁省,沈阳市,浑南区,辽宁省沈阳市浑南区,辽宁工程职业学院
辽宁省,沈阳市,浑南区,辽宁省沈阳市浑南区,辽宁职业学院
辽宁省,沈阳市,浑南区,辽宁省沈阳市浑南区,沈阳职业技术学院
辽宁省,辽阳市,白塔区,辽宁省辽阳市白塔区,辽宁建筑职业学院
辽宁省,辽阳市,白塔区,辽宁省辽阳市白塔区,辽宁铁道职业技术学院
辽宁省,辽阳市,白塔区,辽宁省辽阳市白塔区铁西路150号,辽阳职业技术学院
辽宁省,铁岭市,银州区,辽宁省铁岭市银州区,铁岭卫生职业学院
辽宁省,铁岭市,银州区,辽宁省铁岭市银州区,铁岭师范高等专科学校
辽宁省,朝阳市,双塔区,辽宁省朝阳市双塔区,朝阳师范学院
辽宁省,阜新市,细河区,辽宁省阜新市细河区育红路36号,阜新高等专科学校
辽宁省,锦州市,太和区,辽宁省锦州市太和区,锦州师范高等专科学校
辽宁省,锦州市,滨海新区,辽宁省锦州市滨海新区昆山路9号,辽宁理工职业大学
辽宁省,营口市,站前区,辽宁省营口市站前区,营口职业技术学院
辽宁省,大连市,甘井子区,辽宁省大连市甘井子区,海军大连舰艇学院
辽宁省,沈阳市,皇姑区,辽宁省沈阳市皇姑区,解放军沈阳炮兵学院
内蒙古自治区,呼和浩特市,新城区,内蒙古自治区呼和浩特市新城区,内蒙古大学
内蒙古自治区,呼和浩特市,新城区,内蒙古自治区呼和浩特市新城区,内蒙古农业大学
内蒙古自治区,呼和浩特市,新城区,内蒙古自治区呼和浩特市新城区,内蒙古师范大学
内蒙古自治区,呼和浩特市,新城区,内蒙古自治区呼和浩特市新城区,内蒙古医科大学
内蒙古自治区,呼和浩特市,新城区,内蒙古自治区呼和浩特市新城区,内蒙古工业大学
内蒙古自治区,呼和浩特市,新城区,内蒙古自治区呼和浩特市新城区,内蒙古财经大学
内蒙古自治区,呼和浩特市,新城区,内蒙古自治区呼和浩特市新城区,内蒙古大学创业学院
内蒙古自治区,呼和浩特市,新城区,内蒙古自治区呼和浩特市新城区,内蒙古艺术学院
内蒙古自治区,呼和浩特市,新城区,内蒙古自治区呼和浩特市新城区成吉思汗大街呼哈公路6.5公里处,内蒙古经贸外语职业学院
内蒙古自治区,呼和浩特市,新城区,内蒙古自治区呼和浩特市新城区,内蒙古美术职业学院
内蒙古自治区,呼和浩特市,新城区,内蒙古自治区呼和浩特市新城区,内蒙古北方职业技术学院
内蒙古自治区,呼和浩特市,新城区,内蒙古自治区呼和浩特市新城区,内蒙古化工职业学院
内蒙古自治区,呼和浩特市,新城区,内蒙古自治区呼和浩特市新城区,内蒙古机电职业技术学院
内蒙古自治区,呼和浩特市,新城区,内蒙古自治区呼和浩特市新城区,内蒙古商贸职业学院
内蒙古自治区,呼和浩特市,回民区,内蒙古自治区呼和浩特市回民区光明路街道西村前街1号,内蒙古建筑职业技术学院
内蒙古自治区,呼和浩特市,回民区,内蒙古自治区呼和浩特市回民区内蒙古民族学院校内,呼和浩特民族学院
内蒙古自治区,呼和浩特市,赛罕区,内蒙古自治区呼和浩特市赛罕区大学西路,内蒙古丰州职业学院
内蒙古自治区,呼和浩特市,赛罕区,内蒙古自治区呼和浩特市赛罕区学府路,内蒙古电子信息职业技术学院
内蒙古自治区,呼和浩特市,赛罕区,内蒙古自治区呼和浩特市赛罕区通道北路,呼和浩特职业学院
